{
  "schema_version": "1.0.0",
  "profile_id": "ABS.PROFILE.ENTERPRISE",
  "name": "Enterprise",
  "version": "1.0.0",
  "purpose": "Standard framework with stricter privacy, approval, evidence, and release policy",
  "status": "CANDIDATE",
  "required_modules": [
    "ABS.MODULE.ADAPTERS.PLATFORMS",
    "ABS.MODULE.ARCHITECTURE.MODULARITY",
    "ABS.MODULE.CAPABILITY.CONNECTORS",
    "ABS.MODULE.CAPABILITY.MANAGER",
    "ABS.MODULE.CAPABILITY.ROUTING",
    "ABS.MODULE.CAPABILITY.SKILLS",
    "ABS.MODULE.CONTROL.DECISIONS",
    "ABS.MODULE.CONTROL.RELEASE",
    "ABS.MODULE.CONTROL.SESSIONS",
    "ABS.MODULE.CONTROL.STATE",
    "ABS.MODULE.CONTROL.WORK",
    "ABS.MODULE.ENFORCEMENT.CORE",
    "ABS.MODULE.ENFORCEMENT.OBSERVABILITY",
    "ABS.MODULE.ENFORCEMENT.SECURITY",
    "ABS.MODULE.ENFORCEMENT.TESTING",
    "ABS.MODULE.KERNEL.AUTHORITY_TRUTH",
    "ABS.MODULE.KERNEL.CHANGE_RECOVERY",
    "ABS.MODULE.KERNEL.EVIDENCE_GATES",
    "ABS.MODULE.KERNEL.GOAL_LOCK",
    "ABS.MODULE.KERNEL.IDENTITY",
    "ABS.MODULE.KERNEL.INDEPENDENT_VERIFICATION",
    "ABS.MODULE.KERNEL.LIFECYCLE",
    "ABS.MODULE.KNOWLEDGE.CANONICAL_MODULE",
    "ABS.MODULE.KNOWLEDGE.GRAPH",
    "ABS.MODULE.KNOWLEDGE.PARITY",
    "ABS.MODULE.KNOWLEDGE.PUBLICATION",
    "ABS.MODULE.KNOWLEDGE.RECONCILIATION",
    "ABS.MODULE.KNOWLEDGE.VISUALS",
    "ABS.MODULE.PROFILES.PROJECT",
    "ABS.MODULE.RUNTIME.EXECUTOR"
  ],
  "optional_modules": [
    "ABS.MODULE.ADDON.OPERATIONS"
  ],
  "required_adapters": [],
  "policy_overlays": {
    "approval": "risk_based",
    "canonical_source": "repository_backed",
    "independent_final_verification": true,
    "writes": "shadow_first",
    "classification_enforcement": "strict",
    "publication_owner_review": true,
    "two_person_high_risk_approval": true,
    "retention_and_rights_review": true
  },
  "installation_mode": "SHADOW_FIRST",
  "authority": "Module composition and stricter policy only; never downstream project truth.",
  "rollback": "Restore the pre-installation project checkpoint and remove generated projection/configuration paths."
}
